Id,Comentario,Carga
273,"Hay un serio complejo de inferioridad en @lopezobrador_, su gabinete y sus aplaudidores.

Tienen todo puesto en charola de plata, presumen sus 30 millones de votos, tienen mayoría en las cámaras y NO PUEDEN.

Padecen disfuncion de poder

Son la #MafiaDelQuererYNoPoder",Negativo
274,Mienten los que aseguran que se prometió q la violencia terminaría por acto d magia el 1ro de Julio. hay mucho que trabajar. AMLO NO ESTAS SOLO ,Positivo
275,"Jamás se realizará el sueño de los fachitos, que AMLO ya no sea presidente... Se tendrán que aguantar todo el sexenio. Pobres dan una lástima, verdad @lopezdoriga ????",Positivo
276,"Saben cuántos años llevo diciendo, en todos los foros, que @lopezobrador_  es un peligro para México? Desde 1999, cuando hizo trampa para ser jefe de gobierno del DF! Si, 20 años de mentadas de madre e insultos! Y no me arrepiento! Ya lo comprobaron? Se los dije! Al tiempo!",Negativo
277,"Ahora resulta que los muertos en los años que gobernó el PRIAN no importan, cuando el culpable es @FidelHerrera y el  borracho de @FelipeCalderon... No le hacen ni cosquillas al presidente AMLO, hasta se ríe de sus ridículos pedorros. Saludos @GlodeJo07",Positivo
278,"déjate de mentiras, la guerra contra el crimen es real. No te hagas pendejo @lopezobrador_. Ya no es chairos vs fifis, al parecer es pueblo vs narcogobierno",Negativo
279,Llevo más de 12 años diciéndoles que @lopezobrador_ es un peligro para México. Que conste. ,Negativo
280,"Quienes pactaron y entregaron al país al crimen organizado? El PRIAN. No se confundan, estas ratas siguen protegiendo a las bandas criminales del narco y huachicol. No dudaría que su estrategia es incrementar la violencia para golpear a AMLO. Al tiempo, van a caeran estas ratas. ",Positivo
281,"La oposición es tan insignificante que de Twitter no pasa. En cambio AMLO siempre tendrá el apoyo no solo en redes, sino en las calles y en cada rincón de este país.",Positivo
282,"La matanza de Minatitlán fue obra del PRIAN, han hasta matado a un niño para que su foto sea explotada para hacer daño a AMLO. Sabotaje criminal y traidor a la Patria.
Han dejado su huella típica",Positivo
283,"Que Veracruz sea un Estado fallido, no es nada nuevo. La novedad es que algunos ingenuos comienzan a abrir los ojos a la realidad: las cosas lejos de mejorar con el gobierno actual de AMLO y Cuitláhuac, están poniéndose cada vez peor.",Negativo
284,estamos con #AMLO hasta el final.,Positivo
285,"Pedir la renuncia de AMLO es una estupidez, los Mexicanos le dimos nuestro apoyo y no estará solo en esta guerra contra el crimen organizado, que ahora no vengan a querer lavarse las manos como Pilatos, esto es #SangreDelPRIAN y unidos todos remontaremos la cuesta",Positivo
286,"¿Enserio le piden a AMLO que renuncie cuando le justificaron a @FelipeCalderon 150 mil muertos?

Son una oposición muy pitera, de eso no hay duda.",Positivo
287,Los jóvenes no estamos contigo @lopezobrador_  al menos no los que estudiamos y sabemos distinguir entre realidad y lo que tu quieres venderle al país con cada conferencia en las mañanas en donde NO OFRECES SOLUCIONES,Negativo
288,"Toda su vida política se la paso cuestionando y criticando la corrupción, nepotismo, robos, injusticias entre muchas cosas que realmente pasaban.
Uno pensaría que estando en el poder hiciera lo contrario...

@lopezobrador_  la congruencia no es una virtud en usted!! ",Negativo
289,Una pena tengamos un presidente como @lopezobrador_ que sigue en campaña y no está a la altura que México necesita,Negativo
290,"AMLO no puede
AMLO es soberbio
AMLO es doble cara
AMLO arroja y esconde la mano
AMLO acusa sin pruebas
AMLO divide al pueblo",Negativo
291,"AMLO no tiene proyecto:

* Ni de seguridad.
* Ni económico
* Ni Macroeconómico
* Ni de Turismo.

Solo ocurrencias. ",Negativo
292,"No, López Obrador: TÚ NO decides qué es ni cómo hacer justicia.

Vivimos en un Estado de Derecho, con LEYES que prometiste CUMPLIR y hacer cumplir, o de lo contrario, como ahora, LA NACIÓN TE LO DEMANDA.

Cumple las leyes o  vete y deja de poner a México  en ridículo.",Negativo
293,Cómo siempre AMLO no está sólo somos millones ,Positivo
294,"Buenas, buenas.

Es sábado de gloria y mi país, presa de añejas dinámicas y de pendejadas muy actuales, tiene como presunto presidente a un predicador torpe, necio, pendejo, naco y, sobre todo, HIJO DE PUTA.

Cc @lopezobrador_ #Minatitlán",Negativo
295,"La enanez política de Andrés Manuel ha provocado más problemas que soluciones, su soberbia y su nula capacidad para gobernar son preocupantes.
A Peña le exigimos la renuncia en su tercer año de mandato, AMLO lo consiguió en su 4to mes de gobierno. ",Negativo
296,"Si ante la imagen de UN NIÑO DE UN AÑO DE EDAD MUERTO POR UNA RÁFAGA DE BALAS, lo que te importa es salir a cubrirte las nalgas para seguir mareando pendejos, queda claro que eres mierda entre la mierda, @lopezobrador_ , y vales menos que el polvo que traes en las patas.",Negativo
297,"AMLO Por qué eres parte del pueblo del ciudadano de a pie , por qué eres honrado, eres sin duda un ejemplo a seguir ",Positivo
298,"Andrés Manuel @LopezObrador_ es un buen Presidente.

Ha cumplido en 4 meses la mayoría de sus promesas en campaña.

PAN y PRI con sus ataques diarios con mentiras a AMLO sólo ofenden a México.

Yo estoy con AMLO por ser un estadista.",Positivo
299,Los derechangos ardidos  cuando antes no les importaba  el pueblo,Positivo
300,"o apoyo tu gobierno, sabíamos que no sería fácil, demasiada corrupción y violencia, pero sabemos que tu gobierno busca un  sin asesinatos y masacres.",Positivo
301,Ahora sí  tenemos el Presidente que eligió  la mayoría ,Positivo
302,"La masacre ocurrida en Veracruz fue planeado por la oposición PRI y PAN, caeran los responsables y habra consecuencias graves en contra de esos malditos que buscan el poder con sangre. Van a caer y pagaran sus actos cobardes.",Positivo
303,"Estamos contigo AMLO...la mayoría de los detractores  no tienen memoria y quieren que resuelvas todo,como acto de magía",Positivo
304,"Nunca antes, México ha tenido un Presidente con tal respaldo como ahora, luchamos contigo, de norte a sur, de este a oeste, con nuestro Presidente. ",Positivo
305,AMLO no te daremos la espalda en tu lucha contra la corrupción y la violencia.,Positivo
306,"Aunque les duela vamos poco a poco a mejorar la situación del pais. Ya lo dijo AMLO, ""Ténganme paciencia y confianza. Nos entregaron un país en quiebra."" Esa oposición está desesperada porque se les acaba lo que se robaron.",Negativo
307,"Costó mucho para que lograras la presidencia y hay gente que hace cosas horribles para quitarnos esta oportunidad pero te apoyamos!
",Positivo
308,"El ""no-pensamiento"" de derecha es como una masa enquistada en el cerebro, lo nubla, creo imposible cambiar de pensamiento a los conservadores, en la vida hay que escoger las batallas, convencer a un derechoso es un desperdicio de energía ",Positivo
309,"Duro contra los corruptos, México está contigo presidente y lo bueno que los bots ,no votan.",Positivo
310,"""Sube a 14 cifra de muertos en Minatitlán""

""Hallan cuerpo embolsado en Edomex""

""Asesinan a pintor y su familia en SLP""

El primer trimestre de AMLO ha sido el inicio más violento de los últimos sexenios

Esta es la realidad!
Mientras, López atacando, denigrando, MINTIENDO",Negativo
311,"¿Cuántos más, AMLO? ¿CUÁNTOS MÁS? ",Negativo
312,"A los que piden la ""renuncia de AMLO"" por el triste evento ocurrido en #MinatitlanSangreDelPRIAN , están equivocados, ahora es cuando más se necesita un Presidente que no dude y que haga lo que se tiene que hacer, esto es #SangreDelPRIAN, pero nos salpica a todos.",Positivo
313,"Los más feroces críticos de AMLO son los mismos que aplaudieron la estrategia fallida de Felipe Calderón, estos son los resultados... mucho trabajo por delante.

",Positivo
314,No representas a todos unicamente una parte medicore como tu @lopezobrador_  eres tu el falso mesias y con un populismo barato! A la mierda con tu gobierno,Negativo
315,"¿Alguien sabe si el imbécil de  @lopezobrador_ ya dijo algo de lo ocurrido en Minatitlán?, ¿siquiera dió el pésame a las familias?",Negativo
316,"-¿Sabe el presidente de la masacre en Minatitlán? 
-¿Sabe el presidente que la violencia y la inseguridad recorren imparables al país? 
-¿Sabe el presidente que crece el número de homicidios dolosos? 
-Sabe @lopezobrador_ que él es el presidente?",Negativo
317,"Acá en Sinaloa durante el sexenio de Calderon asesinaron a más de 15 personas en una fiesta, no me acuerdo que hicieran escándalo los medios de comunicación a nivel nacional, solo sonó en mi estado... 
Pero se oponen a la guardia nacional y no dejan trabajar a AMLO.",Positivo
318,"A @lopezobrador_ le tomó pocas horas pronunciarse en sus cuentas oficiales sobre el SUICIDIO de Alan García, expresidente de PERÚ. Han pasado más de 24 horas de la MASACRE de Minatitlán y ni sus luces. Están muy claras las PRIORIDADES de este gobierno.",Negativo
319,"Al país se lo esta llevando la chingada y @lopezobrador_ en lugar de gobernar para todo #México, véanlo, que bonito se expresa!

Hay tanta rabia como ignorancia en sus palabras.
#VeracruzEstadoFallido 

¡ME AVERGUENZO DE TENER UN PRESIDENTE COMO ESTE! TÚ TAMBIÉN ¿VERDAD?",Negativo
320,"Cuando @lopezobrador_ supo de la tragedia en la catedral de Notre Dame dió las condolencias de inmediato pero de lo acontecido en Minatitlán no ha querido decir nada.

¿que clase de presidente tenemos que le vale madre su propia gente?

 #VeracruzEstadoFallido
#ConLosNiñosNo",Negativo
321,Mira @lopezobrador_ para que aprendas un poco de diplomacia y de como se debe expresar un jefe de Estado ,Negativo
322,"AMLO la silla, la presidencia, el país, te quedaron muy grandes.


",Negativo
323,"¿Saben quiénes están bien agradecidos con AMLO y su gabinete por la nueva estrategia para combatir al narco y la delincuencia?

El narco y la delincuencia.",Negativo
324,"@lopezobrador_ hipócrita, saqueador, mentiroso, CORRUPTO, dictador de cuarta, NO TE QUEREMOS. RENUNCIA! #amlonomerepresenta",Negativo
325,"Tuvieron 6 años cada uno, dejaron un chiquero de país y hasta defienden su gestión... ¿con qué calidad moral critican a #AMLO que lleva apenas 4 meses en el cargo? ",Positivo
326,"@lopezobrador_
Tus omisiones en seguridad pública también violan los derechos humanos. 

¡Tú negligencia fomenta la violencia!
",Negativo
327,"Eres una pena como Presidente! No vales madre, no tienes huevos, le has dado en la madre al país en 100 días. Mejor renuncia pedazo de pelmazo!! ",Negativo
328,"Frente al luto y dolor de las familias.
Frente a la legítima exigencia de seguridad y paz.
Frente a las miles de voces que piden respete y haga respetar la Constitución y el Estado de Derecho.
Usted responde con insultos y descalificaciones, presidente @lopezobrador_.

¿Por qué? ",Negativo
329,"Quien ante una tragedia fomenta división y encono, no merece ser Presidente de un país.

Eres un Presidentito de papel, Lopitos, un presidente muy enano para este gran país.

Te queda muy grande el cargo @lopezobrador_",Negativo
330,"Y no cabe duda que tú no sabes gobernar, que eres un inepto que no acepta la responsabilidad y solo se escuda en discursos baratos. Tú mensaje funciona con un pueblo ignorante y mantenido, no con el pueblo trabajador y preparado. ",Negativo
331,"Al único que veo callar ahora es a usted, mínimo una condolencia, algo que demuestre que le interesa lo que está sucediendo en el país, pero no, usted está más preocupado por seguir su campaña.


",Negativo
332,"                    México Tiene a AMLO, el mejor presidente del mundo 

Es un honor estar con Obrador",Positivo
333,"Aplaudieron como focas al sociópata @FelipeCalderon que bañó de sangre al país y llevó la tragedia a cientos de miles de familias mexicanas.
Hoy le piden resultados inmediatos a @lopezobrador_ quien lidia con recuperar al país del infierno en el que lo convirtieron.
Cínicos. ",Positivo
334,"¿Que harán hoy? Estuviste jodiendo 18 años para llegar y llevas 140 días diciendo:

- Yo no fui, fue Tete.
- Tengo otros datos.
- No tengo pruebas ni dudas

Y lo que se sume. Cabron pendejo bueno para nada. Responsabilizate 30',000,000 de pendejos te dieron chamba. Cumple",Negativo
335,Duele decirlo pero tiene razón yo vote por el creyendo que iba a tirar la basura y la está metiendo abajo de la alfombra...su alfombra,Negativo
336,Te amo cabecita de algodón,Positivo
337,"No mames.

De verdad estos tipos son tan fanáticos que sí @lopezobrador_ atropellara un niño, dirían que el niño era miembro neoliberal del prian queriendo desprestigiar a su cabecita de algodón.
",Negativo
338,"Son las 09:15 de la mañana. 
El Presidente de México no aparece. 
La Pax Narca a la que le apostó, lo traicionó anoche. 
Delincuentes desalmados, que saben que “la guerra” vs. ellos ya se terminó, amenazan, atacan, matan, seguirán asesinado. 
AMLO, el amoroso, no da la cara.",Negativo
339,"El irresponsable demagogo panfletario de @epigmenioibarra acusa al “régimen corrupto” de la tragedia en Minatitlán.

La verdad, seguimos en un régimen corrupto.

La corrupción no se soluciona con pura saliva.

Veremos cuántos detenidos presenta el fiscal carnal de @lopezobrador_.",Negativo
340,"Sr. @lopezobrador_  antes de tuitear sobre Notre Dame y estar rezando Salmos por favor atienda el tema de Minatitlán que es lo que apremia, usted dedicó sus ultimos años a la tragedia de los 43 de Ayotzinapa... haga su trabajo y deje de enmascarar las cifras que no ayuda!",Negativo
341,¡AMLOve con AMLOve se paga! Andrés Manuel @lopezobrador_ ha hecho lo que NUNCA IMAGINASTE ver en un presidente de México 😱😱😱 ,Positivo
342,"¿Quien carajo manda hacer algo como lo de #Minatitlán? ¿Que clase de crimen organizado, mafia u organización hace algo así?¿Que mierda tienen en la cabeza? ¿Y ustedes @lopezobrador_ @CuitlahuacGJ? ¿No sera pinche hora de que al menos tubieran definido un plan de seguridad?",Negativo
343,"Más
Una NO primera dama que su prioridad es su carrera de cantante, un presidente que se siente Mesías evadiendo la realidad de un México que cada día esta peor, hoy 13 ejecutados en Minatitlan, entre ellos un inocente bebé, que asco siento de este pinche gobierno @lopezobrador_
",Negativo
344,"Princesas y bros, saben quién más aparte de @lopezobrador_ traía los zapatos sucios? Exacto Francisco I. Madero, qué tal eh  ",Positivo
345,Mientras la #Oposiciónde5ta ya no haya qué inventar ni qué hacer para atacar al Presidente @lopezobrador_ Él sigue mostrando que le hacen lo que el viento a Juárez! Su popularidad crece y crece 💪,Positivo
346,Si hemos apoyado a la Ultra Derecha Conservadora traicionera que no apoyemos a la primera Izquierda que gobierna México . ,Positivo
347,"AMLO Eres un gran hombre por eso vote por ti, que orgullosa estoy de que seas mi Presidente, llevas el corazón en la mano.",Positivo
348,Por ser un hombre honesto y justo,Positivo
349,Aunque la tengas muy difícil @lopezobrador_ porque la derecha dejó un México  destrozado el pueblo confía y te apoyo,Positivo
350,"El 1 de julio los mexicanos mandamos al carajo al narco Estado, ese que acabó con la esperanza y las aspiraciones de una generación. 

Ustedes crearon esta pesadilla y hoy la alimentan y no lo vamos a permitir.",Positivo
351,ni un paso atrás viva la 4 transformación al 100 %,Positivo
352,"Hicimos historia ! 
Somos millones a tu lado AMLO",Positivo
353,muchos sabemos que lo que ocurrió en #Minatitlán  ya viene hace años.,Positivo
354,"Desde el estado de Morelos, respaldo respaldo a nuestro Presidente Andrés Manuel López Obrador, la 4ta Transformación está comenzando. 
#AmloElPuebloTeApoya  ",Positivo
355,"Seré contundente, millones y yo seguimos con ahínco la #4T, no nos detendrán, no lo impedirán, la primavera mexicana viene con todo.
",Positivo
356,¡Es un honor estar con Obrador!!,Positivo
357,El pueblo lo apoya y lo quiere un chingo Don Andres!,Positivo
358,"AMLO estamos con tigo se que nó es fácil después de cómo dejaron la casa, pero como dices tú despacito. ",Positivo
359,"La oposición es tan insignificante que de Twitter no pasa. En cambio AMLO siempre tendrá el apoyo no solo en redes, sino en las calles y en cada rincón de este país.",Positivo
360,"Yo si apoyo a mi presidente, que miserables son estos fifis, lucrar con el dolor ajeno. Verdades escorias.",Positivo
361,En ti confiamos mi querido señor Presidente  Lo estás dando TODO. Te amo mi presidente,Positivo
362,"Sabíamos q no iba a ser fácil, conspiraron en 2 ocasiones para q no llegaras a la presidencia a transparentar y señalar a quienes tanto daño han hecho al país.
Hoy q estás al frente,las causalidades no dan tregua,sabemos quiénes están detrás.",Positivo
363,"hemos superado sexenios completos de desastre nacional, corrupción e impunidad. Tenemos un sexenio para demostrar que somos mejores. 
La oposición pedorra quiere vernos caer y lucran con la desgracia pero no lo lograrán.",Positivo
364,El pueblo después de varias décadas tiene el poder y no lo vamos a soltar...,Positivo
365,Ésto es lo que les duele al #PRIANAsesino que a @lopezobrador_  que el pueblo ame a AMLO,Positivo
366,Señores hagamos viral el apoyo a nuestro Presidente juntos por la #4T y ni un paso atrás ,Positivo
367,"Leo los tweets de los que andan promoviendo el hashtag ""amlorenuncia"" y reafirmo que en México la oposición es patética, hipócrita, insolente y sinvergüenza.",Positivo
368,"porque mientras más te atacan, más creces. Porque los que te atacan jamás hicieron el esfuerzo necesario de cambiar al país. Tu no te rindes a pesar de los obstáculos del pri, del pan, del poder judicial y un sin fin de detractores. ¡Que viva México!",Positivo
369,"Que coraje para los fachos amantes de la corrupción ver un HT que le salio gratis al presidente mientras ellos gasta mucho dinero en sus granjas de bots.
",Positivo
370,"Y no necesita ni de mi apoyo ni el de los priandejos, ya tiene el apoyo y respaldo de la mayoría de los Mexicanos",Positivo
371,PRI y PAN son capaz de vender su alma al diablo con tal de que a AMLO le vaya mal pero no contaban con que los mexicanos lo apoyan,Positivo
372,Nos quieren hacer creer que AMLO es responsable de la masacre de Minatitlán. ,Positivo
373,"Años de violencia no se borran de la noche a la mañana, solo con voluntad de todos este infierno heredado podrá terminar.",Positivo
374,"Es
       Un 
              Honor 
                          Estar 
                                   Con 
                                           OBRADOR 

Simplemente #YoEstoyConAMLO
porque:

Quiero un mejor país. 
¿Y tú?",Positivo
375, todo méxico es territorio AMLO ,Positivo
376,"Apocalipsis 17:14  Pelearán contra el Cordero, y el Cordero los vencerá, porque él es Señor de señores y Rey de reyes…",Positivo
377,"De ❤ les digo, que él siempre ha luchado por nosotros. Es momento de apoyarlo. Estás campañas en su contra (y de todo México) no funcionaran. 😊",Positivo
378,"Mateo 11:28 Venid a mí, todos los que estáis cansados y cargados, y yo os haré descansar.",Positivo
379,"TODO EL APOYO INCONDICIONAL PARA LOGRAR LO QUE LA MAYORIA MERECEMOS(XQ FACHOS,CHAYOTES Y EMPREMIERDAS NO)ECHEMOS PA'DELANTE LA 4T..!!EL CAMINO ES LARGO..PERO NO PODEMOS AFLOJAR MI GNT..!",Positivo
380,"AMLO es la opción Porqué sabemos quiénes pactaron contra México, estamos consientes quienes atentan contra nuestra Patria desde hace mucho PRIAN ",Positivo
381,"¡Hoy tenemos día con día
Mucha inseguridad
Porque se soltó la perra
Todo lo vino a regar
Entre todos los granjeros
La tenemos que amarrar!

El tigre no te abandonará @lopezobrador_ 
",Positivo
382,Todos somos Amlo!!! ,Positivo
383,¡A mí no se me olvida este gran día! #TodoMiApoyoaAMLO ,Positivo
384,"Pase lo que pase y digan lo que digan, siempre apoyaré a mi presidente ",Positivo
385,No soy bots.  Mi familia y yo apoyamos al  a nuestro Presidente.. ,Positivo
386,Hasta el final contigo AMLO.,Positivo
387,El pueblo votó por un cambio y se está construyendo día a día. Lo que destruyeron en 30 años las políticas neoliberales llevará su tiempo para revertirlo.,Positivo
388,"Es momento de demostrar cuántos somos y porque arrasó @lopezobrador_ ,es momento de reflexionar y fortalecer convicciones o acaso queremos el México de antes: el de la rapiña,el de la indolencia,el del abuso,el de la corrupción?",Positivo
389,AMLO Usted es lo que necesita nuestro país.,Positivo
390,AMLO te apoyo Porque sé perfectamente que nadie quería que llegaras a ser presidente de México y todos están ardidos y haciendo lo posible para atacarte de cualquier cosa,Positivo
391,Entre más lo ataquen más lo apoya su pueblo ,Positivo
392,"AMLO hoy y siempre, y lo seguiremos haciendo por México. ",Positivo
393,¡Vamos mexicanos! demostremos a los bots de la derecha que 30 millones votamos por MORENA.,Positivo
394,"sabemos perfecto quiénes están detrás de sabotajes y asesinatos, el la derecha rapaz. No vencerán.",Positivo
395," @lopezobrador_
#AMLOelMejorPresidenteDelMundo 
#AmloElPuebloTeApoya 
#JuntosHaremosHistoria
",Positivo
396,"ahora sabemos como han robado a la nación por #AMLO,a hecho mucho en muy poco tiempo, solo ver cómo le preguntan los reporteros,Eso no lo hubiera hecho otro.A la hora de las mañaneras cualquier otro estaría en su quinto sueño,hasta yo me levanto temprano.",Positivo
397,"Si, tú cuentas conmigo, yo cuento contigo, y cada uno contamos con el otro. 
Por México. Morena  
AMLO extraordinario ser humano.",Positivo
398,ASI ES ENTRE MAS PIEDRAS LE ARROJEN MAS GRANDE SE HACE SU NOMBRE @lopezobrador_,Positivo
399,"Mexicanos nos ha costado
TIEMPO, TRABAJO y VOLUNTAD
dejar de comer comida chatarra,
para que el INE nos imponga partidos chatarras.

El pueblo quiere una vida política SANA,
que NO cause daño al progreso de la Patria.
Luego por esas porquerías, la KAGAM.....

",Positivo
400,"Una cosa es tener dificultades para abastecer combustible y otra el oportunismo de los enemigos de Mexico y de su presidente @lopezobrador_ que no se dobla, ni se doblará, en el combate al huachicoleo. #AmloElPuebloTeApoya ",Positivo
401,Por supuesto que ha sido una medida fuerte y dolorosa que en cierto modo ha modificado nuestro esquema de consumo de gasolina. Pero bien vale la pena el esfuerzo para reducir de tajo el robo de combustible y su consecuente daño patrimonial.,Positivo
402,Se redujo 22.5% el secuestro durante el primer mes de gestión #AMLO: Alto al Secuestro,Positivo
403,"HAY CONFIANZA A NUESTRO PRESIDENTE, ",Positivo
404,"Hoy dos de mis mejores amigas de la infancia me llamaron traidora y fanática, ellas son panistas. Me dejaron de hablar. Qué triste, pero aún que sea mi propia familia, nunca dejare de ser AMLOVER.",Positivo
405,yo estoy disfrutando a mi Presidente!,Positivo
406,El Aprecio De Los Mexicanos Lo Tiene AMLO Y Ni Con Su Vida Peña Nieto Lo Podría Comprar,Positivo
407,Nos costó años de lucha pero hoy tenemos al mejor Presidente de México y se llama Andrés Manuel López Obrador,Positivo
408,"Ooootra vez, las desgracias que vivimos hoy son producto de la enorme corrupción de los ineptos y corruptos gobiernos anteriores que permitieron que sucediera y creciera, además de coludirse y ser cómplices. AMLO no es culpable",Positivo
409,"Que raro que las cuentas basura de twitter que festejaban la desaparición de los 43 normalistas ahora exigen (jaja) que #AMLOPresidente renuncie por la violencia que dejaron 12 años de PRIAN.
Son pendejos, burdos, y tremendamente hipócritas.
",Positivo
410,Vamos por el cambio pesele a quien le pese,Positivo
411,"Durante 12 años el dijo tener la solución inmediata a todos los problemas del país y ahora que al fin tiene el poder que tanto anheló, resultó que no puede con el puesto.
Sus mentiras ya lo alcanzaron y sus malas decisiones nos están afectando a todos.
",Negativo
412,"Hazle un favor a México , ya causaste suficiente daño",Negativo
413,"Que se escuche fuerte y claro a nivel mundial!!

AMLO es un inepto y mentiroso, y en México, no lo queremos!!",Negativo
414,"La enanez política de Andrés Manuel ha provocado más problemas que soluciones, su soberbia y su nula capacidad para gobernar son preocupantes.
A Peña le exigimos la renuncia en su tercer año de mandato, AMLO lo consiguió en su 4to mes de gobierno. ",Negativo
415,"Ningún presidente, NINGUNO en la historia de México, había tenido un desempeño tan mediocre y patético en menos de 6 meses. ",Negativo
416,"La intolerancia, la negación y la irresponsabilidad y usar al pueblo como escudo es algo que no se debe tolerar.",Negativo
417,Por inepto. Por corrupto. Por insensible. Por necio. Por traidor. ,Negativo
418,"Cancelacion del NAIM
Tren maya
Retiro de apoyo a estancias infantiles
Cancelacion del Inadem
Dinosaurios expriistas en puestos claves
Contratos de obra sin licitacion
Sin proyectos claros en economia y seguridad
Y un largo etc de ocurrencias y pendejadas",Negativo
419,"¡Suficiente! ¡Yo no voté por esto, @lopezobrador_!",Negativo
420,YA somos mas los que no nos dejamos engañar.... ARRIBA AMLO PRESIDENTE DE Mexico,Positivo
421,"Ay lo malo es que ya no sé si creerle a amlo, ya con eso de que asignó obras directas a sus amigos y mucho priista en su partido. Ha reclutado a mucho corrupto.",Negativo
422,"Usted es todo lo bueno que puede representar a los buenos mexicanos. Por un México sin violencia, yo te apoyo AMLO. Mis dos grandes maestros de Historia QEPD estarían muy orgullosos de tenerlo como presidente.",Positivo
